{
  "schema_version": 1,
  "kind": "GROUNDED_REVIEW_PACKET",
  "status": "PROPOSED",
  "story_slug": "scene-workflow-fixture",
  "target": {
    "scene_id": "SC-001",
    "draft_path": "drafts/EP-001/SC-001.md"
  },
  "context_source_mode": "working-tree",
  "raw_draft": {
    "origin": "WORKING_TREE",
    "path": "drafts/EP-001/SC-001.md",
    "content": "ASSERTION: The fixed gate is red at SC-001 and opens only with the physical token.\nASSERTION: Unit A does not know the token code at SC-001; code knowledge may begin only after SC-003.\nASSERTION: Unit A's physical-token ownership, scene-start stock, and expenditure count at SC-001 are UNKNOWN; exactly one physical token exists.\nASSERTION: Unit A's access to the upper gallery at SC-001 is UNKNOWN; the stairs and upper gallery are unfinished and not usable.\nASSERTION: This draft's human approval is UNVERIFIED; canon status is not established and ledger application is unauthorized.\n",
    "sha256": "6d8435c931d91da22cd7a56e74f1d03c79519caaedda6c096ec2085074bc1da3",
    "byte_length": 586,
    "git_blob_id": "b870d99ab6e3acab6d2235a8ce778921e5e3df46",
    "raw_status": "MATCH"
  },
  "scene_preparation": {
    "content": {
      "schema_version": 1,
      "kind": "SCENE_PREPARATION",
      "status": "PROPOSED",
      "preparation": "PREPARED_WITH_EXPLICIT_UNKNOWNS",
      "story": "scene-workflow-fixture",
      "scene_cursor": {
        "scene_id": "SC-001",
        "boundary": "BEFORE"
      },
      "world_cursor": null,
      "cursor_mapping": "UNKNOWN_NO_AUTOMATIC_MAPPING",
      "pov": "CHAR-001",
      "human_editorial_approval": "UNVERIFIED",
      "canon_change_authorized": false,
      "ledger_apply_authorized": false,
      "author_planning_context": {
        "content": "# STORY ENGINE / SELECTED-STORY LOCAL CONTEXT PACK\nTarget: SC-001 | Max approved recent episodes: 7\nINPUT BASIS: Selected-story local registries and source records. Approval labels are local declarations; GitHub main and human approval have not been authenticated. Drafts and proposals do not establish canon.\nDo not use information from future episodes. Do not silently update canon.\n\n## REQUIRED WRITING STYLE\n# Synthetic assertion style\r\nUse labeled metadata assertions only; add no narrative prose.\r\nSYNTHETIC FIXTURE LABEL ONLY; no record in this workspace is human editorial approval or authenticated signoff.\r\n\n\n## APPROVED EPISODE LEDGER (RECENT ONLY)\n\nNo earlier approved episodes. Planned beats are not canon prose.\n\n## PRIOR APPROVED SCENE EXCERPTS (SAME EPISODE)\n\nNo previously approved scenes in this episode.\n\n# CONTEXT PACK: SC-001\n\n> Generated from repository data. Do not treat this file as a replacement for approved prose.\n\n## CONTEXT SCOPE\nSelected scene only; current project progress is withheld.\n\n## NON-NEGOTIABLE AGENT RULES\n\n1. LOCKED user directives override AI proposals. No retroactive changes without approval.\n\n2. Proposed material and planned beats are not approved history.\n\n3. Do not update canon or approved story_state before human review.\n\n4. Preserve scene-start knowledge, inventory and state boundaries; UNKNOWN is not verified.\n\n## STORY-SPECIFIC RULES\n\n- SYNTHETIC FIXTURE LABEL ONLY; no record in this workspace is human editorial approval or authenticated signoff.\n\n- Metadata assertions are fixture inputs, not semantic-review results.\n\n## APPROVED CANON IN SCOPE\n\n- **FACT-STRUCTURE** At SC-001, only the ground floor is built; the stairs and upper gallery are unfinished and not usable.\n\n- **FACT-CODE** Unit A does not know the token code at SC-001; code knowledge may begin only after SC-003.\n\n- **FACT-TOKEN** Exactly one physical token exists at SC-001.\n\n- **FACT-GATE** At SC-001, the gate is fixed red and opens only with the physical token.\n\n## SELECTED SCENE: SC-001\n\n## RELEVANT SCENES & CAUSAL ORDER\n\nBeats and outcomes are scene plans, not knowledge available to the POV at scene start.\n\n### SC-001 Synthetic present-time scene (APPROVED)\n\nGoal: Exercise source-bound scene-start context. / Conflict: Keep fixture facts and unknowns separate.\n\nBeats: Metadata assertion only.\n\nOutcome: No world-state change is declared.\n\nPreconditions: none\n\nEffects: {}\n\n## CHARACTERS IN SCOPE\n\n- **CHAR-001 Unit A** — Synthetic metadata unit; unknown: Token code before the SC-003 boundary\n\n  - Knowledge at scene start: UNKNOWN (no earlier scene-linked entries).\n\n## INVENTORY EVENTS IN RELEVANT SCENES (PLANNED ≠ APPROVED)\n\n## OPEN PLOT THREADS\n\nUntimed/future/unapproved thread details are withheld. OPEN is a working registry label, not reconstructed historical state.\n\n## APPROVED WORLD STATE BEFORE TARGET (INITIAL BASELINE IF NO PROSE APPROVED)\n\nOnly explicit prior local evidence is used. Local approval labels are not authenticated GitHub approval; later progress is not inferred.\n\n{\n  \"availability\": \"UNKNOWN\",\n  \"reason\": \"No approved state snapshot is available before the requested scene. The latest snapshot cannot reconstruct earlier state; do not infer it from planned effects.\"\n}\n\n## OPEN ISSUES\n\nEpisode-level questions and target inventory operations are withheld: no scene-start disclosure boundary is recorded.\n\n## REQUIRED OUTPUT CONTRACT\n1. Work within the requested scene scope only.\n2. List newly proposed facts, never silently promoted to CANON.\n3. Record proposed state/items/locations and knowledge changes.\n4. Report continuity and evidence uncertainty; human approval remains required.\n\n## EXACT SOURCE EVIDENCE (metadata remains working-tree)\n{\"commit\": \"3c4590c5d3f2f03eebd08190a4902e522de52734\", \"metadata_basis\": \"WORKING_TREE_REGISTRIES\", \"mode\": \"working-tree\", \"scope\": \"CONTEXT_READS_NOT_VALIDATION_AUDIT\", \"sources\": {\"bible/STYLE_GUIDE.md\": {\"git_blob_id\": \"0111cde93222bcfc87eedf84287cdd5a3a1eb6ee\", \"raw_byte_length\": 205, \"raw_sha256\": \"558a32bcb779acad39269083130163e527c7760f71c12abcaeb4215fcfa85596\", \"raw_status\": \"MATCH\", \"selected_byte_length\": 205, \"selected_sha256\": \"558a32bcb779acad39269083130163e527c7760f71c12abcaeb4215fcfa85596\"}}}\n",
        "basis": "WORKING_TREE_METADATA_WITH_EXPLICIT_SOURCE_MODE",
        "warning": "Target beats and user directives are author inputs, not events or POV knowledge."
      },
      "scene_references": {
        "characters": [
          {
            "id": "CHAR-001",
            "name": "Unit A"
          }
        ],
        "location": {
          "id": "LOC-001",
          "name": "Synthetic gatehouse",
          "pov_layout_knowledge": "UNKNOWN"
        },
        "planned_item_ids": [
          "ITEM-TOKEN"
        ],
        "inventory": {
          "earlier_local_approved_events": [],
          "current_balance": "UNKNOWN",
          "note": "No inferred totals, initial stock, zero quantities or planned gains."
        },
        "open_threads": {
          "eligible_registry_references": [],
          "historical_open_state": "UNKNOWN",
          "note": "Untimed, future and unapproved setups withheld; current OPEN is not historical proof."
        }
      },
      "pov_knowledge": {
        "availability": "UNKNOWN",
        "entries": [],
        "untimed_traits": "WITHHELD",
        "note": "House disclosure is separately source-labelled; world preview is not POV knowledge."
      },
      "house_reference": {
        "availability": "NOT_REQUESTED",
        "reason": "No house ID supplied; no house or ownership inferred."
      },
      "world_preview": {
        "audience": "AUTHOR_ONLY_NOT_POV_KNOWLEDGE",
        "result": {
          "availability": "NOT_REQUESTED",
          "reason": "No world cursor supplied; scene order is not world time."
        }
      },
      "source_evidence": {
        "mode": "working-tree",
        "commit": "3c4590c5d3f2f03eebd08190a4902e522de52734",
        "metadata_basis": "WORKING_TREE_REGISTRIES",
        "sources": {
          "bible/STYLE_GUIDE.md": {
            "selected_sha256": "558a32bcb779acad39269083130163e527c7760f71c12abcaeb4215fcfa85596",
            "selected_byte_length": 205,
            "git_blob_id": "0111cde93222bcfc87eedf84287cdd5a3a1eb6ee",
            "raw_sha256": "558a32bcb779acad39269083130163e527c7760f71c12abcaeb4215fcfa85596",
            "raw_byte_length": 205,
            "raw_status": "MATCH"
          },
          "drafts/EP-001/SC-001.md": {
            "selected_sha256": "6d8435c931d91da22cd7a56e74f1d03c79519caaedda6c096ec2085074bc1da3",
            "selected_byte_length": 586,
            "git_blob_id": "b870d99ab6e3acab6d2235a8ce778921e5e3df46",
            "raw_sha256": "6d8435c931d91da22cd7a56e74f1d03c79519caaedda6c096ec2085074bc1da3",
            "raw_byte_length": 586,
            "raw_status": "MATCH"
          },
          "drafts/EP-002/SC-002.md": {
            "selected_sha256": "12567a3ee8ac4b3a28ee0ad70ade98b0eec9eff947cde4d1c9d7635cc9a076c9",
            "selected_byte_length": 134,
            "git_blob_id": "a2f76a45a4e7d67223ba3c7519a4c8556287f454",
            "raw_sha256": "12567a3ee8ac4b3a28ee0ad70ade98b0eec9eff947cde4d1c9d7635cc9a076c9",
            "raw_byte_length": 134,
            "raw_status": "MATCH"
          },
          "ledger/episodes/EP-001.md": {
            "selected_sha256": "43df123868fb045c9b294d3d972c61a1059b35af50935d21c642210f35891e28",
            "selected_byte_length": 163,
            "git_blob_id": "9a12a0c03225bc4184e09425c7bb28ad8b79b815",
            "raw_sha256": "43df123868fb045c9b294d3d972c61a1059b35af50935d21c642210f35891e28",
            "raw_byte_length": 163,
            "raw_status": "MATCH"
          },
          "ledger/episodes/EP-002.md": {
            "selected_sha256": "1c17a9fba14783aef9eecc60fa50514147201a750486d1a294c830f1cff3a7b9",
            "selected_byte_length": 163,
            "git_blob_id": "8cce38ff99aff89c49e1e5f669e8eb6e94b172d5",